{"$id":"urn:saydone:authoring:saydone-authoring-operations-v1","$schema":"https://json-schema.org/draft/2020-12/schema","additionalProperties":false,"properties":{"baseChecksum":{"pattern":"^[a-f0-9]{64}$","type":"string"},"baseRevision":{"maxLength":96,"minLength":1,"pattern":"^[^\\u0000-\\u001f]+$","type":"string"},"operations":{"items":{"oneOf":[{"additionalProperties":false,"properties":{"defaultLocale":{"maxLength":16,"minLength":2,"pattern":"^[a-z]{2}(?:-[A-Z]{2})?$","type":"string"},"description":{"maxLength":4096,"minLength":1,"pattern":".*\\S.*","type":"string"},"entryBlockKey":{"maxLength":64,"minLength":1,"pattern":"^[a-z][a-z0-9_]*$","type":"string"},"kind":{"const":"configure_bot"},"name":{"maxLength":1024,"minLength":1,"pattern":".*\\S.*","type":"string"}},"required":["kind","name","defaultLocale","entryBlockKey"],"type":"object"},{"additionalProperties":false,"properties":{"allowedValues":{"items":{"type":["string","number","boolean","null"]},"maxItems":32,"minItems":1,"type":"array"},"format":{"enum":["phone","email"]},"key":{"maxLength":64,"minLength":1,"pattern":"^[a-z][a-z0-9_]*$","type":"string"},"kind":{"const":"upsert_data_field"},"label":{"maxLength":1024,"minLength":1,"pattern":".*\\S.*","type":"string"},"max":{"type":"number"},"min":{"type":"number"},"scope":{"enum":["flow","user"]},"valueType":{"enum":["text","number","boolean"]},"visibility":{"enum":["standard","technical"]}},"required":["kind","key","label","scope","valueType"],"type":"object"},{"additionalProperties":false,"properties":{"format":{"enum":["plain","telegram_html","telegram_markdown_v2"]},"key":{"maxLength":64,"minLength":1,"pattern":"^[a-z][a-z0-9_]*$","type":"string"},"kind":{"const":"upsert_content"},"optionalFieldKeys":{"items":{"maxLength":64,"minLength":1,"pattern":"^[a-z][a-z0-9_]*$","type":"string"},"maxItems":32,"type":"array"},"requiredFieldKeys":{"items":{"maxLength":64,"minLength":1,"pattern":"^[a-z][a-z0-9_]*$","type":"string"},"maxItems":32,"type":"array"},"text":{"maxLength":4096,"minLength":1,"pattern":".*\\S.*","type":"string"}},"required":["kind","key","format","text"],"type":"object"},{"additionalProperties":false,"properties":{"key":{"maxLength":64,"minLength":1,"pattern":"^[a-z][a-z0-9_]*$","type":"string"},"kind":{"const":"upsert_block"},"mode":{"const":"stateful"},"text":{"maxLength":1024,"minLength":1,"pattern":".*\\S.*","type":"string"}},"required":["kind","key","mode","text"],"type":"object"},{"additionalProperties":false,"properties":{"key":{"maxLength":64,"minLength":1,"pattern":"^[a-z][a-z0-9_]*$","type":"string"},"kind":{"const":"upsert_block"},"mode":{"const":"transient"},"nextBlockKey":{"maxLength":64,"minLength":1,"pattern":"^[a-z][a-z0-9_]*$","type":"string"},"text":{"maxLength":1024,"minLength":1,"pattern":".*\\S.*","type":"string"}},"required":["kind","key","mode","text","nextBlockKey"],"type":"object"},{"additionalProperties":false,"properties":{"blockKey":{"maxLength":64,"minLength":1,"pattern":"^[a-z][a-z0-9_]*$","type":"string"},"contentKey":{"maxLength":64,"minLength":1,"pattern":"^[a-z][a-z0-9_]*$","type":"string"},"kind":{"const":"set_content_block"}},"required":["kind","blockKey","contentKey"],"type":"object"},{"additionalProperties":false,"properties":{"blockKey":{"maxLength":64,"minLength":1,"pattern":"^[a-z][a-z0-9_]*$","type":"string"},"choices":{"items":{"additionalProperties":false,"properties":{"aliases":{"items":{"maxLength":1024,"minLength":1,"pattern":".*\\S.*","type":"string"},"maxItems":8,"minItems":1,"type":"array"},"key":{"maxLength":64,"minLength":1,"pattern":"^[a-z][a-z0-9_]*$","type":"string"},"label":{"maxLength":1024,"minLength":1,"pattern":".*\\S.*","type":"string"},"nextBlockKey":{"maxLength":64,"minLength":1,"pattern":"^[a-z][a-z0-9_]*$","type":"string"},"saveFieldKey":{"maxLength":64,"minLength":1,"pattern":"^[a-z][a-z0-9_]*$","type":"string"}},"required":["key","label","saveFieldKey"],"type":"object"},"maxItems":8,"minItems":1,"type":"array"},"contentKey":{"maxLength":64,"minLength":1,"pattern":"^[a-z][a-z0-9_]*$","type":"string"},"kind":{"const":"set_choice_block"}},"required":["kind","blockKey","contentKey","choices"],"type":"object"},{"additionalProperties":false,"properties":{"choiceKey":{"maxLength":64,"minLength":1,"pattern":"^[a-z][a-z0-9_]*$","type":"string"},"continuationBlockKey":{"maxLength":64,"minLength":1,"pattern":"^[a-z][a-z0-9_]*$","type":"string"},"inputMappings":{"items":{"additionalProperties":false,"properties":{"callerFieldKey":{"maxLength":64,"minLength":1,"pattern":"^[a-z][a-z0-9_]*$","type":"string"},"subflowFieldKey":{"maxLength":64,"minLength":1,"pattern":"^[a-z][a-z0-9_]*$","type":"string"}},"required":["callerFieldKey","subflowFieldKey"],"type":"object"},"maxItems":8,"minItems":1,"type":"array"},"kind":{"const":"connect_choice_to_subflow"},"outputMappings":{"items":{"additionalProperties":false,"properties":{"callerFieldKey":{"maxLength":64,"minLength":1,"pattern":"^[a-z][a-z0-9_]*$","type":"string"},"subflowFieldKey":{"maxLength":64,"minLength":1,"pattern":"^[a-z][a-z0-9_]*$","type":"string"}},"required":["callerFieldKey","subflowFieldKey"],"type":"object"},"maxItems":8,"minItems":1,"type":"array"},"sourceBlockKey":{"maxLength":64,"minLength":1,"pattern":"^[a-z][a-z0-9_]*$","type":"string"},"subflowKey":{"maxLength":64,"minLength":1,"pattern":"^[a-z][a-z0-9_]*$","type":"string"}},"required":["kind","sourceBlockKey","choiceKey","subflowKey","continuationBlockKey"],"type":"object"},{"additionalProperties":false,"properties":{"kind":{"const":"set_routing"},"route":{"const":"entry"},"targetBlockKey":{"maxLength":64,"minLength":1,"pattern":"^[a-z][a-z0-9_]*$","type":"string"}},"required":["kind","route","targetBlockKey"],"type":"object"},{"additionalProperties":false,"properties":{"command":{"maxLength":64,"minLength":2,"pattern":"^/[a-z][a-z0-9_]*$","type":"string"},"kind":{"const":"set_routing"},"route":{"const":"command"},"targetBlockKey":{"maxLength":64,"minLength":1,"pattern":"^[a-z][a-z0-9_]*$","type":"string"}},"required":["kind","route","command","targetBlockKey"],"type":"object"},{"additionalProperties":false,"properties":{"kind":{"const":"set_routing"},"route":{"const":"fallback"},"targetBlockKey":{"maxLength":64,"minLength":1,"pattern":"^[a-z][a-z0-9_]*$","type":"string"}},"required":["kind","route","targetBlockKey"],"type":"object"},{"additionalProperties":false,"properties":{"kind":{"const":"set_start_payload"},"payload":{"maxLength":64,"minLength":1,"pattern":"^[a-zA-Z0-9_-]+$","type":"string"},"targetBlockKey":{"maxLength":64,"minLength":1,"pattern":"^[a-z][a-z0-9_]*$","type":"string"}},"required":["kind","payload","targetBlockKey"],"type":"object"},{"additionalProperties":false,"properties":{"blockKey":{"maxLength":64,"minLength":1,"pattern":"^[a-z][a-z0-9_]*$","type":"string"},"equalsAny":{"items":{"maxLength":1024,"minLength":1,"pattern":".*\\S.*","type":"string"},"maxItems":8,"minItems":1,"type":"array"},"ignoreCase":{"type":"boolean"},"kind":{"const":"set_text_route"},"targetBlockKey":{"maxLength":64,"minLength":1,"pattern":"^[a-z][a-z0-9_]*$","type":"string"}},"required":["kind","blockKey","equalsAny","targetBlockKey"],"type":"object"},{"additionalProperties":false,"properties":{"blockKey":{"maxLength":64,"minLength":1,"pattern":"^[a-z][a-z0-9_]*$","type":"string"},"fieldKey":{"maxLength":64,"minLength":1,"pattern":"^[a-z][a-z0-9_]*$","type":"string"},"inputType":{"enum":["text","number","email","phone","telegram_contact"]},"kind":{"const":"set_typed_input"},"nextBlockKey":{"maxLength":64,"minLength":1,"pattern":"^[a-z][a-z0-9_]*$","type":"string"}},"required":["kind","blockKey","fieldKey","inputType","nextBlockKey"],"type":"object"},{"additionalProperties":false,"properties":{"blockKey":{"maxLength":64,"minLength":1,"pattern":"^[a-z][a-z0-9_]*$","type":"string"},"kind":{"const":"set_subflow_call"},"subflowKey":{"maxLength":64,"minLength":1,"pattern":"^[a-z][a-z0-9_]*$","type":"string"},"thenBlockKey":{"maxLength":64,"minLength":1,"pattern":"^[a-z][a-z0-9_]*$","type":"string"}},"required":["kind","blockKey","subflowKey","thenBlockKey"],"type":"object"},{"additionalProperties":false,"properties":{"entryBlockKey":{"maxLength":64,"minLength":1,"pattern":"^[a-z][a-z0-9_]*$","type":"string"},"inputFieldKeys":{"items":{"maxLength":64,"minLength":1,"pattern":"^[a-z][a-z0-9_]*$","type":"string"},"maxItems":32,"type":"array"},"key":{"maxLength":64,"minLength":1,"pattern":"^[a-z][a-z0-9_]*$","type":"string"},"kind":{"const":"upsert_subflow"},"outputFieldKeys":{"items":{"maxLength":64,"minLength":1,"pattern":"^[a-z][a-z0-9_]*$","type":"string"},"maxItems":32,"type":"array"},"resultBlockKey":{"maxLength":64,"minLength":1,"pattern":"^[a-z][a-z0-9_]*$","type":"string"}},"required":["kind","key","inputFieldKeys","outputFieldKeys","entryBlockKey","resultBlockKey"],"type":"object"},{"additionalProperties":false,"properties":{"blockKey":{"maxLength":64,"minLength":1,"pattern":"^[a-z][a-z0-9_]*$","type":"string"},"fieldKey":{"maxLength":64,"minLength":1,"pattern":"^[a-z][a-z0-9_]*$","type":"string"},"inputType":{"enum":["text","number","email","phone","telegram_contact"]},"kind":{"const":"set_subflow_typed_input"},"nextBlockKey":{"maxLength":64,"minLength":1,"pattern":"^[a-z][a-z0-9_]*$","type":"string"},"prompt":{"maxLength":1024,"minLength":1,"pattern":".*\\S.*","type":"string"},"requestContactLabel":{"maxLength":1024,"minLength":1,"pattern":".*\\S.*","type":"string"},"subflowKey":{"maxLength":64,"minLength":1,"pattern":"^[a-z][a-z0-9_]*$","type":"string"}},"required":["kind","subflowKey","blockKey","prompt","fieldKey","inputType","nextBlockKey"],"type":"object"},{"additionalProperties":false,"properties":{"blockKey":{"maxLength":64,"minLength":1,"pattern":"^[a-z][a-z0-9_]*$","type":"string"},"kind":{"const":"set_subflow_terminal"},"subflowKey":{"maxLength":64,"minLength":1,"pattern":"^[a-z][a-z0-9_]*$","type":"string"}},"required":["kind","subflowKey","blockKey"],"type":"object"},{"additionalProperties":false,"properties":{"key":{"maxLength":64,"minLength":1,"pattern":"^[a-z][a-z0-9_]*$","type":"string"},"kind":{"const":"upsert_rule_set"},"otherwiseResult":{"type":["string","number","boolean","null"]},"resultFieldKey":{"maxLength":64,"minLength":1,"pattern":"^[a-z][a-z0-9_]*$","type":"string"},"rules":{"items":{"additionalProperties":false,"properties":{"fieldKey":{"maxLength":64,"minLength":1,"pattern":"^[a-z][a-z0-9_]*$","type":"string"},"key":{"maxLength":64,"minLength":1,"pattern":"^[a-z][a-z0-9_]*$","type":"string"},"operator":{"enum":["equals","notEquals","greaterThan","greaterOrEqual","lessThan","lessOrEqual"]},"result":{"type":["string","number","boolean","null"]},"value":{"type":["string","number","boolean","null"]}},"required":["key","fieldKey","operator","value","result"],"type":"object"},"maxItems":16,"minItems":1,"type":"array"}},"required":["kind","key","resultFieldKey","rules","otherwiseResult"],"type":"object"},{"additionalProperties":false,"properties":{"blockKey":{"maxLength":64,"minLength":1,"pattern":"^[a-z][a-z0-9_]*$","type":"string"},"kind":{"const":"set_rule_set_application"},"nextBlockKey":{"maxLength":64,"minLength":1,"pattern":"^[a-z][a-z0-9_]*$","type":"string"},"ruleSetKey":{"maxLength":64,"minLength":1,"pattern":"^[a-z][a-z0-9_]*$","type":"string"},"subflowKey":{"maxLength":64,"minLength":1,"pattern":"^[a-z][a-z0-9_]*$","type":"string"}},"required":["kind","subflowKey","blockKey","ruleSetKey","nextBlockKey"],"type":"object"},{"additionalProperties":false,"properties":{"args":{"items":{"oneOf":[{"additionalProperties":false,"properties":{"fieldKey":{"maxLength":64,"minLength":1,"pattern":"^[a-z][a-z0-9_]*$","type":"string"}},"required":["fieldKey"],"type":"object"},{"additionalProperties":false,"properties":{"value":{"type":["string","number","boolean","null"]}},"required":["value"],"type":"object"}]},"maxItems":8,"minItems":1,"type":"array"},"blockKey":{"maxLength":64,"minLength":1,"pattern":"^[a-z][a-z0-9_]*$","type":"string"},"kind":{"const":"set_safe_transform"},"nextBlockKey":{"maxLength":64,"minLength":1,"pattern":"^[a-z][a-z0-9_]*$","type":"string"},"operation":{"enum":["concat","uppercase","lowercase","coalesce","url_encode","base64","round","add","subtract","multiply","divide","format_date","timestamp"]},"subflowKey":{"maxLength":64,"minLength":1,"pattern":"^[a-z][a-z0-9_]*$","type":"string"},"targetFieldKey":{"maxLength":64,"minLength":1,"pattern":"^[a-z][a-z0-9_]*$","type":"string"}},"required":["kind","subflowKey","blockKey","targetFieldKey","operation","args","nextBlockKey"],"type":"object"},{"additionalProperties":false,"properties":{"credentialMode":{"enum":["bearer","basic"]},"credentialReference":{"maxLength":64,"minLength":1,"pattern":"^[a-z][a-z0-9_]*$","type":"string"},"endpoint":{"maxLength":2048,"minLength":9,"pattern":"^https://[^\\s\\[\\]]+$","type":"string"},"key":{"maxLength":64,"minLength":1,"pattern":"^[a-z][a-z0-9_]*$","type":"string"},"kind":{"const":"upsert_http_resource"},"method":{"const":"GET"},"request":{"additionalProperties":false,"properties":{"query":{"items":{"additionalProperties":false,"properties":{"fieldKey":{"maxLength":64,"minLength":1,"pattern":"^[a-z][a-z0-9_]*$","type":"string"},"name":{"maxLength":64,"minLength":1,"pattern":"^[A-Za-z][A-Za-z0-9_-]*$","type":"string"}},"required":["name","fieldKey"],"type":"object"},"maxItems":16,"minItems":1,"type":"array"}},"required":[],"type":"object"},"responseMappings":{"items":{"additionalProperties":false,"properties":{"fieldKey":{"maxLength":64,"minLength":1,"pattern":"^[a-z][a-z0-9_]*$","type":"string"},"path":{"maxLength":512,"minLength":2,"pattern":"^/(?:[A-Za-z_][A-Za-z0-9_-]*)(?:/[A-Za-z_][A-Za-z0-9_-]*){0,7}$","type":"string"},"valueType":{"enum":["text","number","boolean","date","datetime"]}},"required":["path","fieldKey","valueType"],"type":"object"},"maxItems":32,"minItems":1,"type":"array"}},"required":["kind","key","endpoint","method","request","responseMappings"],"type":"object"},{"additionalProperties":false,"properties":{"credentialMode":{"enum":["bearer","basic"]},"credentialReference":{"maxLength":64,"minLength":1,"pattern":"^[a-z][a-z0-9_]*$","type":"string"},"endpoint":{"maxLength":2048,"minLength":9,"pattern":"^https://[^\\s\\[\\]]+$","type":"string"},"key":{"maxLength":64,"minLength":1,"pattern":"^[a-z][a-z0-9_]*$","type":"string"},"kind":{"const":"upsert_http_resource"},"method":{"const":"POST"},"request":{"additionalProperties":false,"properties":{"body":{"items":{"additionalProperties":false,"properties":{"fieldKey":{"maxLength":64,"minLength":1,"pattern":"^[a-z][a-z0-9_]*$","type":"string"},"name":{"maxLength":64,"minLength":1,"pattern":"^[A-Za-z][A-Za-z0-9_-]*$","type":"string"}},"required":["name","fieldKey"],"type":"object"},"maxItems":32,"minItems":1,"type":"array"},"query":{"items":{"additionalProperties":false,"properties":{"fieldKey":{"maxLength":64,"minLength":1,"pattern":"^[a-z][a-z0-9_]*$","type":"string"},"name":{"maxLength":64,"minLength":1,"pattern":"^[A-Za-z][A-Za-z0-9_-]*$","type":"string"}},"required":["name","fieldKey"],"type":"object"},"maxItems":16,"minItems":1,"type":"array"}},"required":[],"type":"object"},"responseMappings":{"items":{"additionalProperties":false,"properties":{"fieldKey":{"maxLength":64,"minLength":1,"pattern":"^[a-z][a-z0-9_]*$","type":"string"},"path":{"maxLength":512,"minLength":2,"pattern":"^/(?:[A-Za-z_][A-Za-z0-9_-]*)(?:/[A-Za-z_][A-Za-z0-9_-]*){0,7}$","type":"string"},"valueType":{"enum":["text","number","boolean","date","datetime"]}},"required":["path","fieldKey","valueType"],"type":"object"},"maxItems":32,"minItems":1,"type":"array"}},"required":["kind","key","endpoint","method","request","responseMappings"],"type":"object"},{"additionalProperties":false,"properties":{"blockKey":{"maxLength":64,"minLength":1,"pattern":"^[a-z][a-z0-9_]*$","type":"string"},"input":{"additionalProperties":{"type":["string","number","boolean","null"]},"maxProperties":8,"propertyNames":{"maxLength":64,"minLength":1,"pattern":"^[A-Za-z][A-Za-z0-9_]*$","type":"string"},"type":"object"},"kind":{"const":"set_registered_operation_call"},"operationKey":{"enum":["CREATE_ASSET_ORDER","CREATE_CHECKOUT","DELIVER_ASSET","INITIATE_CLOSED_CLUB_PURCHASE","ADD_CURRENT_USER_TO_SEGMENT","REMOVE_CURRENT_USER_FROM_SEGMENT","HTTP_REQUEST"]}},"required":["kind","blockKey","operationKey","input"],"type":"object"},{"additionalProperties":false,"properties":{"kind":{"const":"set_acceptance"},"scenarios":{"items":{"additionalProperties":false,"properties":{"description":{"maxLength":4096,"minLength":1,"pattern":".*\\S.*","type":"string"},"journey":{"items":{"oneOf":[{"additionalProperties":false,"properties":{"kind":{"const":"start"},"payload":{"maxLength":64,"minLength":1,"pattern":"^[a-zA-Z0-9_-]+$","type":"string"}},"required":["kind"],"type":"object"},{"additionalProperties":false,"properties":{"blockKey":{"maxLength":64,"minLength":1,"pattern":"^[a-z][a-z0-9_]*$","type":"string"},"choiceKey":{"maxLength":64,"minLength":1,"pattern":"^[a-z][a-z0-9_]*$","type":"string"},"expectedBlockKey":{"maxLength":64,"minLength":1,"pattern":"^[a-z][a-z0-9_]*$","type":"string"},"expectedSubflowKey":{"maxLength":64,"minLength":1,"pattern":"^[a-z][a-z0-9_]*$","type":"string"},"kind":{"const":"choose"}},"required":["kind","blockKey","choiceKey","expectedBlockKey"],"type":"object"},{"additionalProperties":false,"properties":{"expectedBlockKey":{"maxLength":64,"minLength":1,"pattern":"^[a-z][a-z0-9_]*$","type":"string"},"expectedSubflowKey":{"maxLength":64,"minLength":1,"pattern":"^[a-z][a-z0-9_]*$","type":"string"},"kind":{"const":"text"},"text":{"maxLength":1024,"minLength":1,"pattern":".*\\S.*","type":"string"}},"required":["kind","text","expectedBlockKey"],"type":"object"},{"additionalProperties":false,"properties":{"expectedBlockKey":{"maxLength":64,"minLength":1,"pattern":"^[a-z][a-z0-9_]*$","type":"string"},"expectedSubflowKey":{"maxLength":64,"minLength":1,"pattern":"^[a-z][a-z0-9_]*$","type":"string"},"kind":{"const":"contact"},"phone":{"maxLength":16,"minLength":8,"pattern":"^\\+[1-9][0-9]{6,14}$","type":"string"}},"required":["kind","phone","expectedBlockKey"],"type":"object"},{"additionalProperties":false,"properties":{"command":{"maxLength":64,"minLength":2,"pattern":"^/[a-z][a-z0-9_]*$","type":"string"},"expectedBlockKey":{"maxLength":64,"minLength":1,"pattern":"^[a-z][a-z0-9_]*$","type":"string"},"expectedSubflowKey":{"maxLength":64,"minLength":1,"pattern":"^[a-z][a-z0-9_]*$","type":"string"},"kind":{"const":"command"}},"required":["kind","command","expectedBlockKey"],"type":"object"},{"additionalProperties":false,"properties":{"kind":{"const":"finish"}},"required":["kind"],"type":"object"}]},"maxItems":32,"minItems":2,"type":"array"},"key":{"maxLength":64,"minLength":1,"pattern":"^[a-z][a-z0-9_]*$","type":"string"}},"required":["key","description","journey"],"type":"object"},"maxItems":16,"minItems":1,"type":"array"}},"required":["kind","scenarios"],"type":"object"},{"additionalProperties":false,"properties":{"kind":{"const":"set_qualification"},"qualificationKey":{"maxLength":64,"minLength":1,"pattern":"^[a-z][a-z0-9_]*$","type":"string"},"scenarioKeys":{"items":{"maxLength":64,"minLength":1,"pattern":"^[a-z][a-z0-9_]*$","type":"string"},"maxItems":16,"minItems":1,"type":"array"}},"required":["kind","qualificationKey","scenarioKeys"],"type":"object"}]},"maxItems":64,"minItems":1,"type":"array"},"operationsVersion":{"const":1}},"required":["operationsVersion","baseRevision","baseChecksum","operations"],"title":"SayDoneAuthoringOperationsV1","type":"object"}