{"baseChecksum":"0123456789abcdef0123456789abcdef0123456789abcdef0123456789abcdef","baseRevision":"bundle_0123456789abcdef01234567","operations":[{"key":"service_kind","kind":"upsert_data_field","label":"Вид сервиса","scope":"flow","valueType":"text"},{"key":"profile_kind","kind":"upsert_data_field","label":"Вид профиля","scope":"flow","valueType":"text"},{"format":"plain","key":"service_menu_content","kind":"upsert_content","text":"Выберите сервис."},{"key":"service_menu","kind":"upsert_block","mode":"stateful","text":"Выберите сервис."},{"blockKey":"service_menu","contentKey":"service_menu_content","kind":"set_content_block"},{"blockKey":"service_menu","choices":[{"key":"setup","label":"Настройка","saveFieldKey":"service_kind"}],"contentKey":"service_menu_content","kind":"set_choice_block"},{"key":"profile_entry","kind":"upsert_block","mode":"stateful","text":"Опишите профиль."},{"key":"profile_result","kind":"upsert_block","mode":"stateful","text":"Профиль готов."},{"key":"service_complete","kind":"upsert_block","mode":"stateful","text":"Сервис выбран."},{"entryBlockKey":"profile_entry","inputFieldKeys":["profile_kind"],"key":"service_profile","kind":"upsert_subflow","outputFieldKeys":["profile_kind"],"resultBlockKey":"profile_result"},{"choiceKey":"setup","continuationBlockKey":"service_complete","inputMappings":[{"callerFieldKey":"service_kind","subflowFieldKey":"profile_kind"}],"kind":"connect_choice_to_subflow","outputMappings":[{"callerFieldKey":"profile_kind","subflowFieldKey":"profile_kind"}],"sourceBlockKey":"service_menu","subflowKey":"service_profile"}],"operationsVersion":1}