{"baseChecksum":"fa111425bfafd200f9189be005746eb059b309279c9ff844de4e09563afe8fe8","baseRevision":"bundle_fa111425bfafd200f9189be0","operations":[{"defaultLocale":"ru","description":"Telegram-бот для первичной квалификации заявок на интеграцию или миграцию.","entryBlockKey":"menu","kind":"configure_bot","name":"Первичный отбор заявок на внедрение"},{"allowedValues":["integration","migration"],"key":"application_type","kind":"upsert_data_field","label":"Тип заявки","scope":"user","valueType":"text"},{"key":"team_size","kind":"upsert_data_field","label":"Размер команды","min":1,"scope":"flow","valueType":"number"},{"allowedValues":["enterprise","standard"],"key":"application_segment","kind":"upsert_data_field","label":"Класс заявки","scope":"flow","valueType":"text"},{"key":"application_label","kind":"upsert_data_field","label":"Метка заявки","scope":"flow","valueType":"text","visibility":"technical"},{"format":"phone","key":"contact_phone","kind":"upsert_data_field","label":"Контакт Telegram","scope":"user","valueType":"text"},{"key":"crm_external_reference","kind":"upsert_data_field","label":"Внешняя ссылка CRM","scope":"user","valueType":"text","visibility":"technical"},{"format":"plain","key":"start_menu","kind":"upsert_content","text":"Выберите тип задачи: integration или migration."},{"format":"plain","key":"help","kind":"upsert_content","text":"Выберите integration или migration, затем укажите размер команды и поделитесь контактом."},{"format":"plain","key":"application_summary","kind":"upsert_content","optionalFieldKeys":["crm_external_reference"],"requiredFieldKeys":["application_type","team_size","application_segment","contact_phone","application_label"],"text":"Тип: {{application_type}}. Команда: {{team_size}}. Класс: {{application_segment}}. Контакт: {{contact_phone}}. Метка: {{application_label}}. Напишите confirm для отправки."},{"blockKey":"details_call","kind":"set_subflow_call","subflowKey":"collect_application_details","thenBlockKey":"summary"},{"blockKey":"menu","choices":[{"key":"integration","label":"Integration","nextBlockKey":"details_call","saveFieldKey":"application_type"},{"key":"migration","label":"Migration","nextBlockKey":"details_call","saveFieldKey":"application_type"}],"contentKey":"start_menu","kind":"set_choice_block"},{"blockKey":"summary","contentKey":"application_summary","kind":"set_content_block"},{"blockKey":"help","contentKey":"help","kind":"set_content_block"},{"key":"fallback","kind":"upsert_block","mode":"stateful","text":"Не понял запрос. Выберите вариант из меню или используйте /help."},{"key":"submit_crm","kind":"upsert_block","mode":"stateful","text":"Заявка отправлена в CRM."},{"command":"/help","kind":"set_routing","route":"command","targetBlockKey":"help"},{"kind":"set_routing","route":"fallback","targetBlockKey":"fallback"},{"kind":"set_start_payload","payload":"partner","targetBlockKey":"menu"},{"blockKey":"summary","equalsAny":["confirm"],"kind":"set_text_route","targetBlockKey":"submit_crm"},{"entryBlockKey":"ask_team_size","inputFieldKeys":["application_type"],"key":"collect_application_details","kind":"upsert_subflow","outputFieldKeys":["team_size","application_segment","application_label","contact_phone"],"resultBlockKey":"details_done"},{"blockKey":"ask_team_size","fieldKey":"team_size","inputType":"number","kind":"set_subflow_typed_input","nextBlockKey":"classify_application","prompt":"Сколько человек будет пользоваться решением?","subflowKey":"collect_application_details"},{"key":"application_segment_rules","kind":"upsert_rule_set","otherwiseResult":"standard","resultFieldKey":"application_segment","rules":[{"fieldKey":"team_size","key":"enterprise_from_team_size","operator":"greaterOrEqual","result":"enterprise","value":20}]},{"blockKey":"classify_application","kind":"set_rule_set_application","nextBlockKey":"build_application_label","ruleSetKey":"application_segment_rules","subflowKey":"collect_application_details"},{"args":[{"value":"qualified"},{"value":":application"}],"blockKey":"build_application_label","kind":"set_safe_transform","nextBlockKey":"ask_contact","operation":"concat","subflowKey":"collect_application_details","targetFieldKey":"application_label"},{"blockKey":"ask_contact","fieldKey":"contact_phone","inputType":"telegram_contact","kind":"set_subflow_typed_input","nextBlockKey":"details_done","prompt":"Поделитесь контактом Telegram для связи по заявке.","requestContactLabel":"Поделиться контактом","subflowKey":"collect_application_details"},{"blockKey":"details_done","kind":"set_subflow_terminal","subflowKey":"collect_application_details"},{"credentialMode":"bearer","credentialReference":"crm_applications_api","endpoint":"https://crm.example.test/v1/applications","key":"crm_submit","kind":"upsert_http_resource","method":"POST","request":{"body":[{"fieldKey":"application_type","name":"application_type"},{"fieldKey":"team_size","name":"team_size"},{"fieldKey":"application_segment","name":"application_segment"},{"fieldKey":"contact_phone","name":"contact_phone"},{"fieldKey":"application_label","name":"application_label"}]},"responseMappings":[{"fieldKey":"crm_external_reference","path":"/application/external_reference","valueType":"text"}]},{"blockKey":"submit_crm","input":{"resourceKey":"crm_submit"},"kind":"set_registered_operation_call","operationKey":"HTTP_REQUEST"},{"kind":"set_acceptance","scenarios":[{"description":"Partner starts integration, team_size 20 becomes enterprise, contact is collected and explicit confirmation submits CRM.","journey":[{"kind":"start","payload":"partner"},{"blockKey":"menu","choiceKey":"integration","expectedBlockKey":"ask_team_size","expectedSubflowKey":"collect_application_details","kind":"choose"},{"expectedBlockKey":"ask_contact","expectedSubflowKey":"collect_application_details","kind":"text","text":"20"},{"expectedBlockKey":"summary","kind":"contact","phone":"+79991234567"},{"expectedBlockKey":"submit_crm","kind":"text","text":"confirm"},{"kind":"finish"}],"key":"partner_enterprise_integration"},{"description":"Default start migration with team_size below 20 becomes standard and follows the same confirmed CRM path.","journey":[{"kind":"start"},{"blockKey":"menu","choiceKey":"migration","expectedBlockKey":"ask_team_size","expectedSubflowKey":"collect_application_details","kind":"choose"},{"expectedBlockKey":"ask_contact","expectedSubflowKey":"collect_application_details","kind":"text","text":"8"},{"expectedBlockKey":"summary","kind":"contact","phone":"+79997654321"},{"expectedBlockKey":"submit_crm","kind":"text","text":"confirm"},{"kind":"finish"}],"key":"standard_migration"},{"description":"The /help command shows the registered help content from the menu.","journey":[{"kind":"start"},{"command":"/help","expectedBlockKey":"help","kind":"command"},{"kind":"finish"}],"key":"help_command"},{"description":"Unknown menu text uses the bounded fallback.","journey":[{"kind":"start"},{"expectedBlockKey":"fallback","kind":"text","text":"unknown request"},{"kind":"finish"}],"key":"menu_fallback"}]},{"kind":"set_qualification","qualificationKey":"implementation_application_screening_v1","scenarioKeys":["partner_enterprise_integration","standard_migration","help_command","menu_fallback"]}],"operationsVersion":1}